{
  "schema_version": 1,
  "id": "spec.agent-fabric.authority",
  "kind": "spec",
  "status": "current",
  "owner": "authority-contract",
  "canonical_keys": [
    "authority.envelope",
    "authority.delegation"
  ],
  "supersedes": [],
  "superseded_by": null,
  "related": {
    "adrs": [
      "adr.capability-compiled-execution"
    ],
    "specs": [],
    "issues": [
      "PROV-AUTH-1"
    ],
    "runbooks": []
  },
  "reviewed_at": "2026-07-13",
  "retention": "durable-knowledge",
  "maximum_lines": 1000
}
